{"authorization":"external-required","complete":true,"coordination":"source-owned","coverage":"PASS","dossier_summary_version":1,"exception_count":1,"kind":"decision-dossier","open_exception_count":1,"outcome":"PASS","receipt_sha256":"5ca351ac58b11b55a3aba867ca1727ad15ea3ad88df56491a7ef45dfa39aa22c","signoff_count":1}
